{
  "contract": 1,
  "id": "fx-sunlance-beam",
  "texture": "fx-sunlance-beam.png",
  "frameSize": [16, 20],
  "anchor": [0, 10],
  "source": "ribs-assets@70989df",
  "clips": {
    "start": { "loop": true, "frames": [
        { "sx": 0, "sy": 0, "sWidth": 16, "sHeight": 20, "durationMs": 50, "tags": ["beam:fire"] },
        { "sx": 16, "sy": 0, "sWidth": 16, "sHeight": 20, "durationMs": 50 },
        { "sx": 32, "sy": 0, "sWidth": 16, "sHeight": 20, "durationMs": 50 }
    ] },
    "start-fade": { "loop": false, "frames": [
        { "sx": 0, "sy": 20, "sWidth": 16, "sHeight": 20, "durationMs": 60 },
        { "sx": 16, "sy": 20, "sWidth": 16, "sHeight": 20, "durationMs": 60 },
        { "sx": 32, "sy": 20, "sWidth": 16, "sHeight": 20, "durationMs": 70 }
    ] },
    "body": { "loop": true, "frames": [
        { "sx": 0, "sy": 40, "sWidth": 16, "sHeight": 20, "durationMs": 50 },
        { "sx": 16, "sy": 40, "sWidth": 16, "sHeight": 20, "durationMs": 50 },
        { "sx": 32, "sy": 40, "sWidth": 16, "sHeight": 20, "durationMs": 50 }
    ] },
    "body-fade": { "loop": false, "frames": [
        { "sx": 0, "sy": 60, "sWidth": 16, "sHeight": 20, "durationMs": 60 },
        { "sx": 16, "sy": 60, "sWidth": 16, "sHeight": 20, "durationMs": 60 },
        { "sx": 32, "sy": 60, "sWidth": 16, "sHeight": 20, "durationMs": 70 }
    ] },
    "end": { "loop": true, "frames": [
        { "sx": 0, "sy": 80, "sWidth": 16, "sHeight": 20, "durationMs": 50 },
        { "sx": 16, "sy": 80, "sWidth": 16, "sHeight": 20, "durationMs": 50 },
        { "sx": 32, "sy": 80, "sWidth": 16, "sHeight": 20, "durationMs": 50 }
    ] },
    "end-fade": { "loop": false, "frames": [
        { "sx": 0, "sy": 100, "sWidth": 16, "sHeight": 20, "durationMs": 60 },
        { "sx": 16, "sy": 100, "sWidth": 16, "sHeight": 20, "durationMs": 60 },
        { "sx": 32, "sy": 100, "sWidth": 16, "sHeight": 20, "durationMs": 70 }
    ] }
  }
}
