{
  "contract": 1,
  "id": "fx-lance-beam",
  "texture": "fx-lance-beam.png",
  "frameSize": [16, 16],
  "anchor": [0, 8],
  "source": "ribs-assets@77f280c",
  "clips": {
    "start": { "loop": true, "frames": [
        { "sx": 0, "sy": 0, "sWidth": 16, "sHeight": 16, "durationMs": 50, "tags": ["beam:fire"] },
        { "sx": 16, "sy": 0, "sWidth": 16, "sHeight": 16, "durationMs": 50 },
        { "sx": 32, "sy": 0, "sWidth": 16, "sHeight": 16, "durationMs": 50 }
    ] },
    "start-fade": { "loop": false, "frames": [
        { "sx": 0, "sy": 16, "sWidth": 16, "sHeight": 16, "durationMs": 60 },
        { "sx": 16, "sy": 16, "sWidth": 16, "sHeight": 16, "durationMs": 60 },
        { "sx": 32, "sy": 16, "sWidth": 16, "sHeight": 16, "durationMs": 70 }
    ] },
    "body": { "loop": true, "frames": [
        { "sx": 0, "sy": 32, "sWidth": 16, "sHeight": 16, "durationMs": 50 },
        { "sx": 16, "sy": 32, "sWidth": 16, "sHeight": 16, "durationMs": 50 },
        { "sx": 32, "sy": 32, "sWidth": 16, "sHeight": 16, "durationMs": 50 }
    ] },
    "body-fade": { "loop": false, "frames": [
        { "sx": 0, "sy": 48, "sWidth": 16, "sHeight": 16, "durationMs": 60 },
        { "sx": 16, "sy": 48, "sWidth": 16, "sHeight": 16, "durationMs": 60 },
        { "sx": 32, "sy": 48, "sWidth": 16, "sHeight": 16, "durationMs": 70 }
    ] },
    "end": { "loop": true, "frames": [
        { "sx": 0, "sy": 64, "sWidth": 16, "sHeight": 16, "durationMs": 50 },
        { "sx": 16, "sy": 64, "sWidth": 16, "sHeight": 16, "durationMs": 50 },
        { "sx": 32, "sy": 64, "sWidth": 16, "sHeight": 16, "durationMs": 50 }
    ] },
    "end-fade": { "loop": false, "frames": [
        { "sx": 0, "sy": 80, "sWidth": 16, "sHeight": 16, "durationMs": 60 },
        { "sx": 16, "sy": 80, "sWidth": 16, "sHeight": 16, "durationMs": 60 },
        { "sx": 32, "sy": 80, "sWidth": 16, "sHeight": 16, "durationMs": 70 }
    ] }
  }
}
