{
  "contract": 1,
  "id": "prop-brazier-socket",
  "texture": "prop-brazier-socket.png",
  "frameSize": [16, 24],
  "anchor": [8, 23],
  "source": "ribs-assets@96b20bc",
  "clips": {
    "empty": { "loop": false, "frames": [
        { "sx": 0, "sy": 0, "sWidth": 16, "sHeight": 24, "durationMs": 200 }
    ] },
    "ignite": { "loop": false, "frames": [
        { "sx": 0, "sy": 24, "sWidth": 16, "sHeight": 24, "durationMs": 50, "tags": ["ignite:start"] },
        { "sx": 16, "sy": 24, "sWidth": 16, "sHeight": 24, "durationMs": 60 },
        { "sx": 32, "sy": 24, "sWidth": 16, "sHeight": 24, "durationMs": 60 },
        { "sx": 48, "sy": 24, "sWidth": 16, "sHeight": 24, "durationMs": 70 }
    ] },
    "lit": { "loop": true, "frames": [
        { "sx": 0, "sy": 48, "sWidth": 16, "sHeight": 24, "durationMs": 110 },
        { "sx": 16, "sy": 48, "sWidth": 16, "sHeight": 24, "durationMs": 110 },
        { "sx": 32, "sy": 48, "sWidth": 16, "sHeight": 24, "durationMs": 110 },
        { "sx": 48, "sy": 48, "sWidth": 16, "sHeight": 24, "durationMs": 110 }
    ] }
  }
}
