{
  "contract": 1,
  "id": "fx-pillar-eternal",
  "texture": "fx-pillar-eternal.png",
  "frameSize": [64, 104],
  "anchor": [32, 94],
  "source": "ribs-assets@70989df",
  "clips": {
    "linger": { "loop": true, "frames": [
        { "sx": 0, "sy": 0, "sWidth": 64, "sHeight": 104, "durationMs": 75, "tags": ["linger:start"] },
        { "sx": 64, "sy": 0, "sWidth": 64, "sHeight": 104, "durationMs": 75 },
        { "sx": 128, "sy": 0, "sWidth": 64, "sHeight": 104, "durationMs": 75 },
        { "sx": 192, "sy": 0, "sWidth": 64, "sHeight": 104, "durationMs": 75 },
        { "sx": 256, "sy": 0, "sWidth": 64, "sHeight": 104, "durationMs": 75 },
        { "sx": 320, "sy": 0, "sWidth": 64, "sHeight": 104, "durationMs": 75 },
        { "sx": 384, "sy": 0, "sWidth": 64, "sHeight": 104, "durationMs": 75 },
        { "sx": 448, "sy": 0, "sWidth": 64, "sHeight": 104, "durationMs": 75 },
        { "sx": 512, "sy": 0, "sWidth": 64, "sHeight": 104, "durationMs": 75 },
        { "sx": 576, "sy": 0, "sWidth": 64, "sHeight": 104, "durationMs": 75 },
        { "sx": 640, "sy": 0, "sWidth": 64, "sHeight": 104, "durationMs": 75 },
        { "sx": 704, "sy": 0, "sWidth": 64, "sHeight": 104, "durationMs": 75 }
    ] },
    "out": { "loop": false, "frames": [
        { "sx": 0, "sy": 104, "sWidth": 64, "sHeight": 104, "durationMs": 83, "tags": ["linger:end"] },
        { "sx": 64, "sy": 104, "sWidth": 64, "sHeight": 104, "durationMs": 83 },
        { "sx": 128, "sy": 104, "sWidth": 64, "sHeight": 104, "durationMs": 83 },
        { "sx": 192, "sy": 104, "sWidth": 64, "sHeight": 104, "durationMs": 83 },
        { "sx": 256, "sy": 104, "sWidth": 64, "sHeight": 104, "durationMs": 83 },
        { "sx": 320, "sy": 104, "sWidth": 64, "sHeight": 104, "durationMs": 83 }
    ] }
  }
}
