{
  "contract": 1,
  "id": "ui-combo",
  "texture": "ui-combo.png",
  "frameSize": [7, 7],
  "anchor": [3, 3],
  "source": "ribs-assets@34f1ed8",
  "clips": {
    "slot-empty": { "loop": false, "frames": [
        { "sx": 0, "sy": 0, "sWidth": 7, "sHeight": 7, "durationMs": 100 }
    ] },
    "slot-l": { "loop": false, "frames": [
        { "sx": 0, "sy": 7, "sWidth": 7, "sHeight": 7, "durationMs": 100 }
    ] },
    "slot-r": { "loop": false, "frames": [
        { "sx": 0, "sy": 14, "sWidth": 7, "sHeight": 7, "durationMs": 100 }
    ] },
    "gain-focus": { "loop": false, "frames": [
        { "sx": 0, "sy": 21, "sWidth": 7, "sHeight": 7, "durationMs": 60 },
        { "sx": 7, "sy": 21, "sWidth": 7, "sHeight": 7, "durationMs": 60 },
        { "sx": 14, "sy": 21, "sWidth": 7, "sHeight": 7, "durationMs": 300 }
    ] },
    "gain-switch": { "loop": false, "frames": [
        { "sx": 0, "sy": 28, "sWidth": 7, "sHeight": 7, "durationMs": 60 },
        { "sx": 7, "sy": 28, "sWidth": 7, "sHeight": 7, "durationMs": 60 },
        { "sx": 14, "sy": 28, "sWidth": 7, "sHeight": 7, "durationMs": 300 }
    ] },
    "gain-rhythm": { "loop": false, "frames": [
        { "sx": 0, "sy": 35, "sWidth": 7, "sHeight": 7, "durationMs": 60 },
        { "sx": 7, "sy": 35, "sWidth": 7, "sHeight": 7, "durationMs": 60 },
        { "sx": 14, "sy": 35, "sWidth": 7, "sHeight": 7, "durationMs": 300 }
    ] }
  }
}
