{
  "contract": 1,
  "id": "prop-skill-pedestal",
  "texture": "prop-skill-pedestal.png",
  "frameSize": [24, 32],
  "anchor": [12, 31],
  "source": "ribs-assets@96b20bc",
  "clips": {
    "idle": { "loop": true, "frames": [
        { "sx": 0, "sy": 0, "sWidth": 24, "sHeight": 32, "durationMs": 140 },
        { "sx": 24, "sy": 0, "sWidth": 24, "sHeight": 32, "durationMs": 140 },
        { "sx": 48, "sy": 0, "sWidth": 24, "sHeight": 32, "durationMs": 140 },
        { "sx": 72, "sy": 0, "sWidth": 24, "sHeight": 32, "durationMs": 140 }
    ] },
    "taken": { "loop": false, "frames": [
        { "sx": 0, "sy": 32, "sWidth": 24, "sHeight": 32, "durationMs": 60, "tags": ["taken:start"] },
        { "sx": 24, "sy": 32, "sWidth": 24, "sHeight": 32, "durationMs": 70 },
        { "sx": 48, "sy": 32, "sWidth": 24, "sHeight": 32, "durationMs": 80 }
    ] },
    "empty": { "loop": false, "frames": [
        { "sx": 0, "sy": 64, "sWidth": 24, "sHeight": 32, "durationMs": 200 }
    ] }
  }
}
