{
  "contract": 1,
  "id": "fx-lance-charge",
  "texture": "fx-lance-charge.png",
  "frameSize": [24, 24],
  "anchor": [12, 12],
  "source": "ribs-assets@77f280c",
  "clips": {
    "charge": { "loop": false, "frames": [
        { "sx": 0, "sy": 0, "sWidth": 24, "sHeight": 24, "durationMs": 100, "tags": ["charge:start"] },
        { "sx": 24, "sy": 0, "sWidth": 24, "sHeight": 24, "durationMs": 100 },
        { "sx": 48, "sy": 0, "sWidth": 24, "sHeight": 24, "durationMs": 100 },
        { "sx": 72, "sy": 0, "sWidth": 24, "sHeight": 24, "durationMs": 100 },
        { "sx": 96, "sy": 0, "sWidth": 24, "sHeight": 24, "durationMs": 100 },
        { "sx": 120, "sy": 0, "sWidth": 24, "sHeight": 24, "durationMs": 100, "tags": ["charge:full"] }
    ] }
  }
}
