{
  "contract": 1,
  "id": "fx-fireshot",
  "texture": "fx-fireshot.png",
  "frameSize": [64, 48],
  "anchor": [2, 24],
  "source": "ribs-assets@77f280c",
  "clips": {
    "burst": { "loop": false, "frames": [
        { "sx": 0, "sy": 0, "sWidth": 64, "sHeight": 48, "durationMs": 50, "tags": ["shot:fire"] },
        { "sx": 64, "sy": 0, "sWidth": 64, "sHeight": 48, "durationMs": 50 },
        { "sx": 128, "sy": 0, "sWidth": 64, "sHeight": 48, "durationMs": 60 },
        { "sx": 192, "sy": 0, "sWidth": 64, "sHeight": 48, "durationMs": 70 },
        { "sx": 256, "sy": 0, "sWidth": 64, "sHeight": 48, "durationMs": 80 }
    ] }
  }
}
