{
  "contract": 1,
  "id": "fx-fire-pillar",
  "texture": "fx-fire-pillar.png",
  "frameSize": [48, 64],
  "anchor": [24, 56],
  "source": "ribs-assets@cd6969e",
  "clips": {
    "rise": { "loop": false, "frames": [
        { "sx": 0, "sy": 0, "sWidth": 48, "sHeight": 64, "durationMs": 40, "tags": ["pillar:start"] },
        { "sx": 48, "sy": 0, "sWidth": 48, "sHeight": 64, "durationMs": 40 },
        { "sx": 96, "sy": 0, "sWidth": 48, "sHeight": 64, "durationMs": 40 }
    ] },
    "burn": { "loop": true, "frames": [
        { "sx": 0, "sy": 64, "sWidth": 48, "sHeight": 64, "durationMs": 70 },
        { "sx": 48, "sy": 64, "sWidth": 48, "sHeight": 64, "durationMs": 70 },
        { "sx": 96, "sy": 64, "sWidth": 48, "sHeight": 64, "durationMs": 70 },
        { "sx": 144, "sy": 64, "sWidth": 48, "sHeight": 64, "durationMs": 70 }
    ] },
    "fade": { "loop": false, "frames": [
        { "sx": 0, "sy": 128, "sWidth": 48, "sHeight": 64, "durationMs": 60, "tags": ["pillar:end"] },
        { "sx": 48, "sy": 128, "sWidth": 48, "sHeight": 64, "durationMs": 70 },
        { "sx": 96, "sy": 128, "sWidth": 48, "sHeight": 64, "durationMs": 80 }
    ] }
  }
}
