{
  "contract": 1,
  "id": "fx-fire-pillar-big",
  "texture": "fx-fire-pillar-big.png",
  "frameSize": [64, 80],
  "anchor": [32, 70],
  "source": "ribs-assets@34f1ed8",
  "clips": {
    "rise": { "loop": false, "frames": [
        { "sx": 0, "sy": 0, "sWidth": 64, "sHeight": 80, "durationMs": 50, "tags": ["pillar:start"] },
        { "sx": 64, "sy": 0, "sWidth": 64, "sHeight": 80, "durationMs": 50 },
        { "sx": 128, "sy": 0, "sWidth": 64, "sHeight": 80, "durationMs": 50 },
        { "sx": 192, "sy": 0, "sWidth": 64, "sHeight": 80, "durationMs": 60 }
    ] },
    "burn": { "loop": true, "frames": [
        { "sx": 0, "sy": 80, "sWidth": 64, "sHeight": 80, "durationMs": 70 },
        { "sx": 64, "sy": 80, "sWidth": 64, "sHeight": 80, "durationMs": 70 },
        { "sx": 128, "sy": 80, "sWidth": 64, "sHeight": 80, "durationMs": 70 },
        { "sx": 192, "sy": 80, "sWidth": 64, "sHeight": 80, "durationMs": 70 }
    ] },
    "fade": { "loop": false, "frames": [
        { "sx": 0, "sy": 160, "sWidth": 64, "sHeight": 80, "durationMs": 70, "tags": ["pillar:end"] },
        { "sx": 64, "sy": 160, "sWidth": 64, "sHeight": 80, "durationMs": 80 },
        { "sx": 128, "sy": 160, "sWidth": 64, "sHeight": 80, "durationMs": 90 }
    ] },
    "smolder": { "loop": true, "frames": [
        { "sx": 0, "sy": 240, "sWidth": 64, "sHeight": 80, "durationMs": 120 },
        { "sx": 64, "sy": 240, "sWidth": 64, "sHeight": 80, "durationMs": 120 },
        { "sx": 128, "sy": 240, "sWidth": 64, "sHeight": 80, "durationMs": 120 }
    ] }
  }
}
