{
  "contract": 1,
  "id": "fx-hellfire-burst",
  "texture": "fx-hellfire-burst.png",
  "frameSize": [48, 48],
  "anchor": [24, 24],
  "source": "ribs-assets@70989df",
  "clips": {
    "burst": { "loop": false, "frames": [
        { "sx": 0, "sy": 0, "sWidth": 48, "sHeight": 48, "durationMs": 40, "tags": ["burst:start"] },
        { "sx": 48, "sy": 0, "sWidth": 48, "sHeight": 48, "durationMs": 50 },
        { "sx": 96, "sy": 0, "sWidth": 48, "sHeight": 48, "durationMs": 60 },
        { "sx": 144, "sy": 0, "sWidth": 48, "sHeight": 48, "durationMs": 70 },
        { "sx": 192, "sy": 0, "sWidth": 48, "sHeight": 48, "durationMs": 90 }
    ] }
  }
}
