{
  "contract": 1,
  "id": "fx-bastion-link",
  "texture": "fx-bastion-link.png",
  "frameSize": [16, 12],
  "anchor": [0, 6],
  "source": "ribs-assets@70989df",
  "clips": {
    "loop": { "loop": true, "frames": [
        { "sx": 0, "sy": 0, "sWidth": 16, "sHeight": 12, "durationMs": 70 },
        { "sx": 16, "sy": 0, "sWidth": 16, "sHeight": 12, "durationMs": 70 },
        { "sx": 32, "sy": 0, "sWidth": 16, "sHeight": 12, "durationMs": 70 },
        { "sx": 48, "sy": 0, "sWidth": 16, "sHeight": 12, "durationMs": 70 }
    ] },
    "node": { "loop": true, "frames": [
        { "sx": 0, "sy": 12, "sWidth": 16, "sHeight": 12, "durationMs": 70 },
        { "sx": 16, "sy": 12, "sWidth": 16, "sHeight": 12, "durationMs": 70 },
        { "sx": 32, "sy": 12, "sWidth": 16, "sHeight": 12, "durationMs": 70 },
        { "sx": 48, "sy": 12, "sWidth": 16, "sHeight": 12, "durationMs": 70 }
    ] }
  }
}
