{
  "contract": 1,
  "id": "fx-breath",
  "texture": "fx-breath.png",
  "frameSize": [56, 40],
  "anchor": [2, 20],
  "source": "ribs-assets@77f280c",
  "clips": {
    "start": { "loop": false, "frames": [
        { "sx": 0, "sy": 0, "sWidth": 56, "sHeight": 40, "durationMs": 50, "tags": ["breath:start"] },
        { "sx": 56, "sy": 0, "sWidth": 56, "sHeight": 40, "durationMs": 50 }
    ] },
    "loop": { "loop": true, "frames": [
        { "sx": 0, "sy": 40, "sWidth": 56, "sHeight": 40, "durationMs": 60, "tags": ["breath:loop"] },
        { "sx": 56, "sy": 40, "sWidth": 56, "sHeight": 40, "durationMs": 60 },
        { "sx": 112, "sy": 40, "sWidth": 56, "sHeight": 40, "durationMs": 60 },
        { "sx": 168, "sy": 40, "sWidth": 56, "sHeight": 40, "durationMs": 60 },
        { "sx": 224, "sy": 40, "sWidth": 56, "sHeight": 40, "durationMs": 60 },
        { "sx": 280, "sy": 40, "sWidth": 56, "sHeight": 40, "durationMs": 60 },
        { "sx": 336, "sy": 40, "sWidth": 56, "sHeight": 40, "durationMs": 60 },
        { "sx": 392, "sy": 40, "sWidth": 56, "sHeight": 40, "durationMs": 60 }
    ] },
    "end": { "loop": false, "frames": [
        { "sx": 0, "sy": 80, "sWidth": 56, "sHeight": 40, "durationMs": 60 },
        { "sx": 56, "sy": 80, "sWidth": 56, "sHeight": 40, "durationMs": 60 },
        { "sx": 112, "sy": 80, "sWidth": 56, "sHeight": 40, "durationMs": 70 }
    ] }
  }
}
